{
  "$schema": "http://json-schema.org/draft-04/schema#",
  "type": "object",
  "properties": {
    "id": {
      "type": "string"
    },
    "missed_session": {
      "type": "integer"
    },
    "model_version": {
      "type": "string"
    },
    "app_version": {
      "type": "string"
    },
    "session_date": {
      "type": "integer"
    },
    "session": {
      "type": "integer"
    },
    "day": {
      "type": "integer"
    },
    "start_time": {
      "type": "number"
    },
    "finished_session": {
      "type": "integer"
    },
    "device_info": {
      "type": "string"
    },
    "tests": {
      "type": "array",
      "items": [
        {
          "type": "object",
          "properties": {
            "type": {
              "type": "string"
            },
            "grid_test": {
              "type": "object",
              "properties": {
                "type": {
                  "type": "string"
                },
                "date": {
                  "type": "number"
                },
                "sections": {
                  "type": "array",
                  "items": [
                    {
                      "type": "object",
                      "properties": {
                        "images": {
                          "type": "array",
                          "items": [
                            {
                              "type": "object",
                              "properties": {
                                "image": {
                                  "type": "string"
                                },
                                "x": {
                                  "type": "integer"
                                },
                                "y": {
                                  "type": "integer"
                                }
                              },
                              "required": [
                                "image",
                                "x",
                                "y"
                              ]
                            },
                            {
                              "type": "object",
                              "properties": {
                                "image": {
                                  "type": "string"
                                },
                                "x": {
                                  "type": "integer"
                                },
                                "y": {
                                  "type": "integer"
                                }
                              },
                              "required": [
                                "image",
                                "x",
                                "y"
                              ]
                            },
                            {
                              "type": "object",
                              "properties": {
                                "image": {
                                  "type": "string"
                                },
                                "x": {
                                  "type": "integer"
                                },
                                "y": {
                                  "type": "integer"
                                }
                              },
                              "required": [
                                "image",
                                "x",
                                "y"
                              ]
                            }
                          ]
                        },
                        "display_test_grid": {
                          "type": "number"
                        },
                        "display_distraction": {
                          "type": "number"
                        },
                        "display_symbols": {
                          "type": "number"
                        },
                        "choices": {
                          "type": "array",
                          "items": [
                            {
                              "type": "object",
                              "properties": {
                                "grid_selection_time": {
                                  "type": "number"
                                },
                                "y": {
                                  "type": "integer"
                                },
                                "selection": {
                                  "type": "integer"
                                },
                                "x": {
                                  "type": "integer"
                                },
                                "image_selection_time": {
                                  "type": "number"
                                },
                                "image": {
                                  "type": "string"
                                }
                              },
                              "required": [
                                "grid_selection_time",
                                "y",
                                "selection",
                                "x",
                                "image_selection_time",
                                "image"
                              ]
                            },
                            {
                              "type": "object",
                              "properties": {
                                "grid_selection_time": {
                                  "type": "number"
                                },
                                "y": {
                                  "type": "integer"
                                },
                                "selection": {
                                  "type": "integer"
                                },
                                "x": {
                                  "type": "integer"
                                },
                                "image_selection_time": {
                                  "type": "number"
                                },
                                "image": {
                                  "type": "string"
                                }
                              },
                              "required": [
                                "grid_selection_time",
                                "y",
                                "selection",
                                "x",
                                "image_selection_time",
                                "image"
                              ]
                            },
                            {
                              "type": "object",
                              "properties": {
                                "grid_selection_time": {
                                  "type": "number"
                                },
                                "y": {
                                  "type": "integer"
                                },
                                "selection": {
                                  "type": "integer"
                                },
                                "x": {
                                  "type": "integer"
                                },
                                "image_selection_time": {
                                  "type": "number"
                                },
                                "image": {
                                  "type": "string"
                                }
                              },
                              "required": [
                                "grid_selection_time",
                                "y",
                                "selection",
                                "x",
                                "image_selection_time",
                                "image"
                              ]
                            }
                          ]
                        },
                        "f_count": {
                          "type": "integer"
                        },
                        "e_count": {
                          "type": "integer"
                        }
                      },
                      "required": [
                        "images",
                        "display_test_grid",
                        "display_distraction",
                        "display_symbols",
                        "choices",
                        "f_count",
                        "e_count"
                      ]
                    },
                    {
                      "type": "object",
                      "properties": {
                        "images": {
                          "type": "array",
                          "items": [
                            {
                              "type": "object",
                              "properties": {
                                "image": {
                                  "type": "string"
                                },
                                "x": {
                                  "type": "integer"
                                },
                                "y": {
                                  "type": "integer"
                                }
                              },
                              "required": [
                                "image",
                                "x",
                                "y"
                              ]
                            },
                            {
                              "type": "object",
                              "properties": {
                                "image": {
                                  "type": "string"
                                },
                                "x": {
                                  "type": "integer"
                                },
                                "y": {
                                  "type": "integer"
                                }
                              },
                              "required": [
                                "image",
                                "x",
                                "y"
                              ]
                            },
                            {
                              "type": "object",
                              "properties": {
                                "image": {
                                  "type": "string"
                                },
                                "x": {
                                  "type": "integer"
                                },
                                "y": {
                                  "type": "integer"
                                }
                              },
                              "required": [
                                "image",
                                "x",
                                "y"
                              ]
                            }
                          ]
                        },
                        "display_test_grid": {
                          "type": "number"
                        },
                        "display_distraction": {
                          "type": "number"
                        },
                        "display_symbols": {
                          "type": "number"
                        },
                        "choices": {
                          "type": "array",
                          "items": [
                            {
                              "type": "object",
                              "properties": {
                                "grid_selection_time": {
                                  "type": "number"
                                },
                                "y": {
                                  "type": "integer"
                                },
                                "selection": {
                                  "type": "integer"
                                },
                                "x": {
                                  "type": "integer"
                                },
                                "image_selection_time": {
                                  "type": "number"
                                },
                                "image": {
                                  "type": "string"
                                }
                              },
                              "required": [
                                "grid_selection_time",
                                "y",
                                "selection",
                                "x",
                                "image_selection_time",
                                "image"
                              ]
                            },
                            {
                              "type": "object",
                              "properties": {
                                "grid_selection_time": {
                                  "type": "number"
                                },
                                "y": {
                                  "type": "integer"
                                },
                                "selection": {
                                  "type": "integer"
                                },
                                "x": {
                                  "type": "integer"
                                },
                                "image_selection_time": {
                                  "type": "number"
                                },
                                "image": {
                                  "type": "string"
                                }
                              },
                              "required": [
                                "grid_selection_time",
                                "y",
                                "selection",
                                "x",
                                "image_selection_time",
                                "image"
                              ]
                            },
                            {
                              "type": "object",
                              "properties": {
                                "grid_selection_time": {
                                  "type": "number"
                                },
                                "y": {
                                  "type": "integer"
                                },
                                "selection": {
                                  "type": "integer"
                                },
                                "x": {
                                  "type": "integer"
                                },
                                "image_selection_time": {
                                  "type": "number"
                                },
                                "image": {
                                  "type": "string"
                                }
                              },
                              "required": [
                                "grid_selection_time",
                                "y",
                                "selection",
                                "x",
                                "image_selection_time",
                                "image"
                              ]
                            }
                          ]
                        },
                        "f_count": {
                          "type": "integer"
                        },
                        "e_count": {
                          "type": "integer"
                        }
                      },
                      "required": [
                        "images",
                        "display_test_grid",
                        "display_distraction",
                        "display_symbols",
                        "choices",
                        "f_count",
                        "e_count"
                      ]
                    }
                  ]
                }
              },
              "required": [
                "type",
                "date",
                "sections"
              ]
            }
          },
          "required": [
            "type",
            "grid_test"
          ]
        }
      ]
    },
    "participant_id": {
      "type": "string"
    },
    "week": {
      "type": "integer"
    },
    "device_id": {
      "type": "string"
    },
    "session_id": {
      "type": "string"
    }
  },
  "required": [
    "id",
    "missed_session",
    "model_version",
    "app_version",
    "session_date",
    "session",
    "day",
    "start_time",
    "finished_session",
    "device_info",
    "tests",
    "participant_id",
    "week",
    "device_id",
    "session_id"
  ]
}