{"id":"1184297432549793752","missed_session":0,"model_version":"","app_version":"1.4.0","session_date":1644508800,"session":0,"day":0,"start_time":1679620675.9657919,"finished_session":1,"device_info":" iOS|x86_64|14.2","tests":[{"type":"cognitive","price_test":{"type":"priceTest","date":1679620691.263927,"sections":[{"question_display_time":33.789087057113647,"good_price":1,"price":"9.35","alt_price":"1.49","correct_index":1,"selection_time":34.65667200088501,"stimulus_display_time":0.0044200420379638672,"selected_index":0,"item":"rolls"},{"question_display_time":35.457715034484863,"good_price":1,"price":"2.87","alt_price":"9.63","correct_index":0,"selection_time":35.657956957817078,"stimulus_display_time":3.0102059841156006,"selected_index":0,"item":"lotion"},{"question_display_time":36.057978987693787,"good_price":0,"price":"7.82","alt_price":"3.62","correct_index":0,"selection_time":36.257745027542114,"stimulus_display_time":6.0142480134963989,"selected_index":0,"item":"cereal"},{"question_display_time":34.65828800201416,"good_price":0,"price":"1.73","alt_price":"5.81","correct_index":1,"selection_time":35.073873043060303,"stimulus_display_time":9.0191049575805664,"selected_index":0,"item":"light bulbs"},{"question_display_time":35.857455968856812,"good_price":1,"price":"3.74","alt_price":"1.46","correct_index":1,"selection_time":36.056424021720886,"stimulus_display_time":12.024301052093506,"selected_index":0,"item":"zucchini"},{"question_display_time":36.259497046470642,"good_price":1,"price":"8.96","alt_price":"1.75","correct_index":1,"selection_time":36.423910021781921,"stimulus_display_time":15.029793977737427,"selected_index":0,"item":"toilet paper"},{"question_display_time":35.075605034828186,"good_price":1,"price":"9.28","alt_price":"3.61","correct_index":0,"selection_time":35.254929065704346,"stimulus_display_time":18.034224033355713,"selected_index":0,"item":"celery"},{"question_display_time":36.425662040710449,"good_price":1,"price":"1.35","alt_price":"3.58","correct_index":0,"selection_time":36.624726057052612,"stimulus_display_time":21.039236068725586,"selected_index":0,"item":"blueberries"},{"question_display_time":35.659510016441345,"good_price":1,"price":"9.47","alt_price":"7.48","correct_index":1,"selection_time":35.855936050415039,"stimulus_display_time":24.045194983482361,"selected_index":0,"item":"dish soap"},{"question_display_time":35.256206035614014,"good_price":1,"price":"2.49","alt_price":"4.79","correct_index":1,"selection_time":35.456066012382507,"stimulus_display_time":27.051676034927368,"selected_index":0,"item":"pineapple"}]}}],"participant_id":"","week":0,"device_id":"CA6DCA59-D4A9-400D-98BE-9515DB9CB2EE","session_id":"1184297432549793752"}