{"id":"-689279989889844462","missed_session":0,"model_version":"","app_version":"1.4.0","session_date":1644508800,"session":0,"day":0,"start_time":1679620556.16537,"finished_session":1,"device_info":" iOS|x86_64|14.2","tests":[{"type":"cognitive","symbol_test":{"type":"symbolsTest","date":1679620569.451175,"sections":[{"correct":2,"appearance_time":0.0028229951858520516,"selection_time":0.88912308216094971,"options":[["6","7"],["3","2"],["0","7"]],"selected":1,"choices":[["0","4"],["6","7"]]},{"correct":2,"appearance_time":0.89794003963470459,"selection_time":1.0218250751495361,"options":[["4","6"],["7","4"],["5","3"]],"selected":1,"choices":[["4","5"],["7","4"]]},{"correct":2,"appearance_time":1.0292010307312012,"selection_time":1.1553109884262085,"options":[["5","6"],["4","5"],["3","1"]],"selected":1,"choices":[["6","0"],["5","6"]]},{"correct":1,"appearance_time":1.1635730266571045,"selection_time":1.2886730432510376,"options":[["4","6"],["4","5"],["7","5"]],"selected":1,"choices":[["4","6"],["5","1"]]},{"correct":2,"appearance_time":1.2973400354385376,"selection_time":1.4219759702682495,"options":[["4","6"],["0","2"],["0","7"]],"selected":1,"choices":[["3","2"],["0","7"]]},{"correct":1,"appearance_time":1.4305260181427002,"selection_time":1.5379700660705566,"options":[["2","5"],["6","4"],["3","7"]],"selected":1,"choices":[["3","7"],["2","7"]]},{"correct":2,"appearance_time":1.5456219911575317,"selection_time":1.9374220371246338,"options":[["7","5"],["5","4"],["0","7"]],"selected":2,"choices":[["0","6"],["0","7"]]},{"correct":1,"appearance_time":1.9447270631790161,"selection_time":2.0888530015945435,"options":[["3","2"],["4","6"],["4","0"]],"selected":2,"choices":[["4","6"],["3","6"]]},{"correct":1,"appearance_time":2.0980310440063477,"selection_time":2.2049700021743774,"options":[["2","1"],["5","3"],["6","4"]],"selected":2,"choices":[["6","4"],["7","1"]]},{"correct":1,"appearance_time":2.2133129835128784,"selection_time":2.6385550498962402,"options":[["0","4"],["6","0"],["6","3"]],"selected":1,"choices":[["6","3"],["4","7"]]},{"correct":1,"appearance_time":2.6475110054016113,"selection_time":2.7720839977264404,"options":[["3","5"],["0","5"],["7","3"]],"selected":1,"choices":[["3","5"],["1","4"]]},{"correct":2,"appearance_time":2.7809339761734009,"selection_time":2.9056999683380127,"options":[["0","2"],["6","0"],["2","4"]],"selected":1,"choices":[["6","1"],["6","0"]]}]}}],"participant_id":"","week":0,"device_id":"CA6DCA59-D4A9-400D-98BE-9515DB9CB2EE","session_id":"-689279989889844462"}