{"id":"-689279989889844462","missed_session":0,"model_version":"","app_version":"1.4.0","session_date":1644508800,"session":0,"day":0,"start_time":1679620466.493099,"finished_session":1,"device_info":" iOS|x86_64|14.2","tests":[{"type":"cognitive","grid_test":{"type":"gridTest","date":1679620505.4101019,"sections":[{"images":[{"image":"key","x":1,"y":0},{"image":"pen","x":4,"y":2},{"image":"phone","x":0,"y":4}],"display_test_grid":17.02863609790802,"display_distraction":5.0148501396179199,"display_symbols":2.0117931365966797,"choices":[{"grid_selection_time":18.77220606803894,"y":0,"selection":0,"x":1,"image_selection_time":19.470639109611511,"image":"key"},{"grid_selection_time":19.955562114715576,"y":3,"selection":2,"x":3,"image_selection_time":20.653958082199097,"image":"pen"},{"grid_selection_time":17.471740126609802,"y":3,"selection":1,"x":0,"image_selection_time":18.303590059280396,"image":"phone"}],"f_count":8,"e_count":0},{"images":[{"image":"key","x":1,"y":1},{"image":"phone","x":0,"y":2},{"image":"pen","x":3,"y":4}],"display_test_grid":38.190559148788452,"display_distraction":26.182744145393372,"display_symbols":23.17937707901001,"choices":[{"grid_selection_time":40.675142168998718,"y":2,"selection":0,"x":2,"image_selection_time":41.191046118736267,"image":"key"},{"grid_selection_time":39.158290147781372,"y":2,"selection":1,"x":1,"image_selection_time":39.690413117408752,"image":"phone"},{"grid_selection_time":41.50871205329895,"y":3,"selection":2,"x":3,"image_selection_time":42.307637095451355,"image":"pen"}],"f_count":8,"e_count":0}]}}],"participant_id":"","week":0,"device_id":"CA6DCA59-D4A9-400D-98BE-9515DB9CB2EE","session_id":"-689279989889844462"}